{"$defs":{"span_ref":{"additionalProperties":false,"properties":{"block_id":{"enum":["B_GLOBAL_TYPED","B_GLOBAL_DESCENT","B_GLOBAL_ORDER"]},"relative_path":{"const":"review_packets/STAGE7_QSPEC_CANDIDATE_V001/BID_GLOBAL_BOUNDARY_DESCENT_QUASI_FREE_COMPLETENESS_V001.md"},"source_sha256":{"const":"949181d78aca143ebef06eacc4ab1018d43cdf79962ee8c78c350f654a7555dd"},"span":{"items":false,"maxItems":2,"minItems":2,"prefixItems":[{"minimum":0,"type":"integer"},{"minimum":0,"type":"integer"}],"type":"array"},"span_sha256":{"pattern":"^[0-9a-f]{64}$","type":"string"}},"required":["block_id","relative_path","source_sha256","span","span_sha256"],"type":"object"}},"$id":"urn:rd22:step11:sp1-07:proof-object:v001","$schema":"https://json-schema.org/draft/2020-12/schema","additionalProperties":false,"properties":{"derivation_id":{"enum":["D01_SHARED_BOUNDARY_DESCENT","D02_THREE_CELL_LEFT_PARENTHESIZATION","D03_THREE_CELL_RIGHT_PARENTHESIZATION","D04_CELL_ORDER_INDEPENDENCE","D05_PRIMITIVE_SHARED_SUPPORT_OVERLAP","D06_GRADED_RECORD_FACTOR_COMMUTATION","D07_VERTEX_RELABELING_COVARIANCE","D08_ORIENTATION_REVERSAL_COVARIANCE","D09_FINITE_STONE_ORDERING"]},"expected_conclusion":{"type":"object"},"gaps":{"items":{"type":"object"},"type":"array"},"proof_axioms":{"const":["SEALED_SOURCE_ASSERTION","DEFINITIONAL_UNFOLDING","CONJUNCTION_INTRODUCTION"]},"row_id":{"const":"C-B-V011-SP1-07"},"schema":{"const":"rd22.step11.sp1-07.proof-object.v001"},"status":{"enum":["KERNEL_READY","PARTIAL_MISSING_STEP"]},"steps":{"items":{"additionalProperties":false,"properties":{"citations":{"items":{"$ref":"#/$defs/span_ref"},"minItems":1,"type":"array"},"inference":{"enum":["SEALED_SOURCE_ASSERTION","DEFINITIONAL_UNFOLDING","CONJUNCTION_INTRODUCTION"]},"premises":{"items":{"type":"string"},"type":"array"},"statement":{"type":"object"},"step_id":{"minLength":1,"type":"string"}},"required":["step_id","inference","premises","statement","citations"],"type":"object"},"minItems":1,"type":"array"},"target_opcode":{"const":"KERNEL"},"used_source_sha256s":{"const":["949181d78aca143ebef06eacc4ab1018d43cdf79962ee8c78c350f654a7555dd"]}},"required":["schema","row_id","derivation_id","target_opcode","status","proof_axioms","used_source_sha256s","expected_conclusion","steps","gaps"],"title":"SP1-07 source-bound proof object","type":"object"}