{"derivation_id":"D01_SHARED_BOUNDARY_DESCENT","expected_conclusion":{"distinct_even_record_factors":true,"global_operator":"h_K=sum_c P_c tensor gamma^5 tensor iota_c(c_c)","one_global_source_car":"CAR(K_Sigma)","predicate":"SHARED_BOUNDARY_DESCENT","shared_vertices_identified_once_by_pushout":true},"gaps":[],"proof_axioms":["SEALED_SOURCE_ASSERTION","DEFINITIONAL_UNFOLDING","CONJUNCTION_INTRODUCTION"],"row_id":"C-B-V011-SP1-07","schema":"rd22.step11.sp1-07.proof-object.v001","status":"KERNEL_READY","steps":[{"citations":[{"block_id":"B_GLOBAL_TYPED","relative_path":"review_packets/STAGE7_QSPEC_CANDIDATE_V001/BID_GLOBAL_BOUNDARY_DESCENT_QUASI_FREE_COMPLETENESS_V001.md","source_sha256":"949181d78aca143ebef06eacc4ab1018d43cdf79962ee8c78c350f654a7555dd","span":[1128,1337],"span_sha256":"8ad57502dc30e189c655bf23d63bbbbd1ae2b1243380b00ce1a0107a5dc20c19"}],"inference":"SEALED_SOURCE_ASSERTION","premises":[],"statement":{"one_global_source_space":"K_Sigma=K_orb tensor S_Dirac","single_car":"CAR(K_Sigma)"},"step_id":"s01"},{"citations":[{"block_id":"B_GLOBAL_TYPED","relative_path":"review_packets/STAGE7_QSPEC_CANDIDATE_V001/BID_GLOBAL_BOUNDARY_DESCENT_QUASI_FREE_COMPLETENESS_V001.md","source_sha256":"949181d78aca143ebef06eacc4ab1018d43cdf79962ee8c78c350f654a7555dd","span":[1258,1704],"span_sha256":"e790ccf12d0d05fdf4f2f017e3fa9555d0b6b448bf9a5e226f63f7dbb2f9d673"}],"inference":"SEALED_SOURCE_ASSERTION","premises":[],"statement":{"record_factors":"R(K)=tensor_(c in K) R_c","record_grading":"EVEN","source_not_copied_per_cell":true},"step_id":"s02"},{"citations":[{"block_id":"B_GLOBAL_DESCENT","relative_path":"review_packets/STAGE7_QSPEC_CANDIDATE_V001/BID_GLOBAL_BOUNDARY_DESCENT_QUASI_FREE_COMPLETENESS_V001.md","source_sha256":"949181d78aca143ebef06eacc4ab1018d43cdf79962ee8c78c350f654a7555dd","span":[2073,2306],"span_sha256":"f7dd7eb59923bc67eda8307841f0a30eeff15418cc3ea5f591325eb1ded163bd"}],"inference":"SEALED_SOURCE_ASSERTION","premises":[],"statement":{"record_labels_identified":false,"shared_vertices_identified_once_by_pushout":true},"step_id":"s03"},{"citations":[{"block_id":"B_GLOBAL_DESCENT","relative_path":"review_packets/STAGE7_QSPEC_CANDIDATE_V001/BID_GLOBAL_BOUNDARY_DESCENT_QUASI_FREE_COMPLETENESS_V001.md","source_sha256":"949181d78aca143ebef06eacc4ab1018d43cdf79962ee8c78c350f654a7555dd","span":[2306,2655],"span_sha256":"e0b8d2ca1b47bdd3293bce858c86fd03b4f72dee6d0d91ec44115c9581707866"}],"inference":"DEFINITIONAL_UNFOLDING","premises":["s01","s02","s03"],"statement":{"global_operator":"h_K=sum_c P_c tensor gamma^5 tensor iota_c(c_c)"},"step_id":"s04"},{"citations":[{"block_id":"B_GLOBAL_DESCENT","relative_path":"review_packets/STAGE7_QSPEC_CANDIDATE_V001/BID_GLOBAL_BOUNDARY_DESCENT_QUASI_FREE_COMPLETENESS_V001.md","source_sha256":"949181d78aca143ebef06eacc4ab1018d43cdf79962ee8c78c350f654a7555dd","span":[2073,2655],"span_sha256":"e0c43a4ea3288323f2e5b254d40bd426640fcd7d1ceae62d1093f5bf9267515a"}],"inference":"CONJUNCTION_INTRODUCTION","premises":["s01","s02","s03","s04"],"statement":{"distinct_even_record_factors":true,"global_operator":"h_K=sum_c P_c tensor gamma^5 tensor iota_c(c_c)","one_global_source_car":"CAR(K_Sigma)","predicate":"SHARED_BOUNDARY_DESCENT","shared_vertices_identified_once_by_pushout":true},"step_id":"s05"}],"target_opcode":"KERNEL","used_source_sha256s":["949181d78aca143ebef06eacc4ab1018d43cdf79962ee8c78c350f654a7555dd"]}