{"derivation_id":"D08_ORIENTATION_REVERSAL_COVARIANCE","expected_conclusion":{"predicate":"ORIENTATION_REVERSAL_COVARIANCE","result":"h_reversed=U_record h_K U_record^-1"},"gaps":[{"gap_id":"G08_ORIENTATION_UNITARY_SQUARE","missing":"the cellular orientation unitary as a typed content-addressed map and its explicit h_K conjugation square","searched_blocks":["B_GLOBAL_DESCENT","B_GLOBAL_ORDER"]}],"proof_axioms":["SEALED_SOURCE_ASSERTION","DEFINITIONAL_UNFOLDING","CONJUNCTION_INTRODUCTION"],"row_id":"C-B-V011-SP1-07","schema":"rd22.step11.sp1-07.proof-object.v001","status":"PARTIAL_MISSING_STEP","steps":[{"citations":[{"block_id":"B_GLOBAL_DESCENT","relative_path":"review_packets/STAGE7_QSPEC_CANDIDATE_V001/BID_GLOBAL_BOUNDARY_DESCENT_QUASI_FREE_COMPLETENESS_V001.md","source_sha256":"949181d78aca143ebef06eacc4ab1018d43cdf79962ee8c78c350f654a7555dd","span":[2073,2306],"span_sha256":"f7dd7eb59923bc67eda8307841f0a30eeff15418cc3ea5f591325eb1ded163bd"}],"inference":"SEALED_SOURCE_ASSERTION","premises":[],"statement":{"orientation_effect":"d_c -> -d_c and P_c invariant"},"step_id":"s01"},{"citations":[{"block_id":"B_GLOBAL_DESCENT","relative_path":"review_packets/STAGE7_QSPEC_CANDIDATE_V001/BID_GLOBAL_BOUNDARY_DESCENT_QUASI_FREE_COMPLETENESS_V001.md","source_sha256":"949181d78aca143ebef06eacc4ab1018d43cdf79962ee8c78c350f654a7555dd","span":[3574,3878],"span_sha256":"e14ea5c29ed3eb2d9257d2f0126c4c88d98c01c9e445f7d2173af8d2820ae859"}],"inference":"SEALED_SOURCE_ASSERTION","premises":["s01"],"statement":{"h_K_covariant":true,"record_quadrature":"conjugated by cellular orientation unitary"},"step_id":"s02"},{"citations":[{"block_id":"B_GLOBAL_ORDER","relative_path":"review_packets/STAGE7_QSPEC_CANDIDATE_V001/BID_GLOBAL_BOUNDARY_DESCENT_QUASI_FREE_COMPLETENESS_V001.md","source_sha256":"949181d78aca143ebef06eacc4ab1018d43cdf79962ee8c78c350f654a7555dd","span":[5816,5992],"span_sha256":"4182599e5a5947acc45712bace6edcf22bef2d34220d0058e5ed29e306a435ad"}],"inference":"SEALED_SOURCE_ASSERTION","premises":["s01","s02"],"statement":{"required_check":"orientation-reversal covariance"},"step_id":"s03"}],"target_opcode":"KERNEL","used_source_sha256s":["949181d78aca143ebef06eacc4ab1018d43cdf79962ee8c78c350f654a7555dd"]}